{
  "kind": "throw",
  "id": "kitsune-throw",
  "name": "Kitsune throw",
  "status": "proposed",
  "source": "kitsune",
  "clip": "kitsune-throw",
  "rules": [
    "C4",
    "E4",
    "E12",
    "E15",
    "F2",
    "T0"
  ],
  "input": {
    "buttons": [
      "LP",
      "LK"
    ]
  },
  "frame_data": {
    "startup": 5,
    "active": 7,
    "recovery": 18,
    "damage": 120,
    "break_window": 7,
    "throwboxes": [
      {
        "frames": [
          6,
          12
        ],
        "rect": {
          "x": 20,
          "y": 150,
          "w": 110,
          "h": 120
        }
      }
    ],
    "hurtboxes": [
      {
        "frames": [
          1,
          30
        ],
        "rect": {
          "x": -25,
          "y": 5,
          "w": 95,
          "h": 310
        }
      }
    ]
  },
  "notes": "Generic throw (C4), 259 shove. Clip 30 frames, palm reach window 6-12: 5/7/18, startup = C4's 5, no deviation. Recovery 18 outlasts the 7-frame break window (E12). The clip carries a 28 cm hip advance that must be replaced by a data step (E15); the throw schema has no forward-travel field, so that step is NOT yet encoded (needs a schema/engine follow-up). Pushback left to fight defaults. Same buttons as Ryo's throw; Ryo's file is a separate id. YOK-33: boxes re-placed from the rigged model poses on their frames (bones at 200 u/m, +pads); frame timing unchanged."
}
